label,variable,distribution,lower,median,upper,,,,Definition of the variables,,,,,,,,,,Project time horizon ,n_years,const,30,,30,,,,time horizon of the project (in years),,,,,,,,,,Risk of natural hazard,NaturHazard,tnorm_0_1,0.1,,0.3,,,,"Probability that a natural hazard occurs, ex-post risk (between 0 and 1)",,,,,,,,,,Discount rate,discount_rate,posnorm,1,,5,,,,Discount rate (used for costs and benefits),,,,,,,,,,Risk of bad maint.,BadMaintenance,tnorm_0_1,0.2,,0.5,,,,"Probability of bad maintenance, relevant only for check dams and buffer strips, ex-post risk (between 0 and 1)",,,,,,,,,,Risk of bad design,BadDesign,tnorm_0_1,0.2,,0.5,,,,"Probability that the intervention is not properly designed, ex-post risk (between 0 and 1)",,,,,,,,,,Risk of non compliance,NonCompliance,tnorm_0_1,0.2,,0.5,,,,"Probability that farmers do not comply with rules resulting from an intervention, e.g. they cultivate again on the banks of the reservoir (between 0 and 1)",,,,,,,,,,Risk pop. non involv. (dredg.),dredge_NonPopInvolv,tnorm_0_1,0.05,,0.15,,,,"Probability that population do not contribute to the dredging, e.g. no labor supply, ex-ante risk (between 0 and 1)",,,,,,,,,,Risk donors non involv. (dredg.),dredge_NonDonorsInvolv,tnorm_0_1,0.04,,0.1,,,,"Probability that donors do not contribute to the dredging, e.g. no funding, ex-ante risk (between 0 and 1)",,,,,,,,,,Risk pop non involv. (check d.),check_NonPopInvolv,tnorm_0_1,0.05,,0.15,,,,"Probability that population do not contribute to check dams, e.g. no labor supply, ex-ante risk (between 0 and 1)",,,,,,,,,,Risk instit. non involv. (check d.),check_NonInstInvolv,tnorm_0_1,0.02,,0.1,,,,"Probability that institutions do not support check dams, e.g. no enforcement upstream, ex-ante risk (between 0 and 1)",,,,,,,,,,Risk donors non involv. (check d.),check_NonDonorsInvolv,tnorm_0_1,0.04,,0.1,,,,"Probability that donors to not contribute to the check dams, e.g. no funding, ex-ante risk (between 0 and 1)",,,,,,,,,,Risk pop non involv. (buffer s.),buffer_NonPopInvolv,tnorm_0_1,0.1,,0.3,,,,"Probability that population do not support buffer strips, e.g. no labor supply, no compliance, ex-ante risk (between 0 and 1)",,,,,,,,,,Risk instit. non involv. (buffer s.),buffer_NonInstInvolv,tnorm_0_1,0.05,,0.15,,,,"Probability that institutions do not support buffer strips, e.g. no participation in the implementation, ex-ante risk (between 0 and 1)",,,,,,,,,,Risk donors non involv. (buffer s.),buffer_NonDonorsInvolv,tnorm_0_1,0.04,,0.1,,,,"Probability that donors to not contribute to buffer strips, e.g. no funding, ex-ante risk (between 0 and 1)",,,,,,,,,,,,,,,,,,,,,,,,,,,,,Current formal irrig. area,current_irrig_area,posnorm,9,,10,,,,Current irrigation formal irrigation area (in ha),,,,,,,,,,,,,,,,,,,,,,,,,,,,,TLU (base),TLU_no_buffer,posnorm,8700,,13000,,,,Total livestock population (TLU) in the current situation (baseline case),,,,,,,,,,TLU change (buffer s.),change_TLU_buffer_perc,norm,-0.1,,0.1,,,,"Change in the total livestock population (TLU) if buffer strips are implemented (in percent, with respect to the baseline)",,,,,,,,,,profit per TLU,profit_per_TLU,posnorm,40,,120,,,,Current profit generated per TU (in dollars),,,,,,,,,,,,,,,,,,,,,,,,,,,,,CV,var_CV,posnorm,5,,20,,,,Desired coefficient of variation in the w function (in percent),Footnote: The w function produces time series that contain variation from a specified mean and a desired coefficient of variation.,,,,,,,,,,,,,,,,,,,,,,,,,,,,Irrig. area lost if pipes clogged (formal) ,pipe_blocked_area_lost_perc,posnorm,10,,50,,,,Irrigated area lost D/S the reservoir if the pipes are clogged by sediments (in percent) ,,,,,,,,,,,,,,,,,,,,,,,,,,,,,Study cost (dredg.),dredging_study_cost,posnorm,7200,,8000,,dredging_PlanningCost,,Study cost for dredging (in dollars),,,,,,,,,,Supervision cost (dredg.),dredging_supervision_cost,posnorm,1600,,4800,,,,Supervision cost for dredging (in dollars),,,,,,,,,,Admin. cost (dredg.),dredging_admin_cost,posnorm,720,,880,,,,Administration cost for dredging (in dollars),,,,,,,,,,Transport cost (dredg.),dredging_transport_cost,posnorm,1450,,1930,,,,Transport cost for dredging (in dollars),,,,,,,,,,Comms cost (dredg.),dredging_communication_cost,posnorm,720,,880,,dredging_PlanningCost,,Communication cost for dredging (in dollars),,,,,,,,,,Culvert-feasibility cost (dredg.),dredging_culvert_feasibility_cost,posnorm,1300,,1600,,dredging_PlanningCost,,Cost of the feasibility study for dredging the culvert U/S the reservoir (in dollars),,,,,,,,,,Culvert-supervision cost (dredg.),dredging_culvert_supervision_cost,posnorm,640,,800,,,,Cost of supervision for dredging the culvert U/S the reservoir (in dollars),,,,,,,,,,,,,,,,,,,,,,,,,,,,,Localization cost (check d.),check_location_cost,posnorm,1600,,4800,,check_dams_PlanningCost,,Expert costs to determinate a suitable location for check dams (in dollars),,,,,,,,,,Feasibility cost (check d.),check_feasibility_cost,posnorm,9600,,14500,,check_dams_PlanningCost,,Cost of the feasibility study for check dams (in dollars),,,,,,,,,,Topobatymetry cost (check d.),check_topobatymetry_cost,posnorm,1000,,1600,,check_dams_PlanningCost,,Cost of a topobatymetry study for check dams (in dollars),,,,,,,,,,Supervision cost (check d.),check_supervision_cost,posnorm,960,,3200,,,,Supervision costs for check dams (in dollars),,,,,,,,,,Training cost (check d.),check_training_cost,posnorm,960,,3200,,,,Cost of training the communities for check dams (in dollars),,,,,,,,,,Comms cost (check d.),check_communication_cost,posnorm,1600,,4800,,check_dams_PlanningCost,,Communication costs for check dams (in dollars),,,,,,,,,,Cost tech devices (check d.),check_tech_devices_cost,posnorm,640,,1300,,,,Cost of small technical devices for check dams (in dollars),,,,,,,,,,Material cost (check d.),check_material_cost,posnorm,5600,,10500,,,,Cost of material for check dams (in dollars),,,,,,,,,,Cost of rocks (check d.),check_rocks_cost,posnorm,4800,,8000,,,,Cost of rocks for check dams  (in dollars),,,,,,,,,,Transport cost (check d.),check_transport_cost,posnorm,3200,,6400,,,,Transport costs for check dams (in dollars),,,,,,,,,,,,,,,,,,,,,,,,,,,,,Comms cost (buffer s.),buffer_communication_cost,posnorm,5000,,20000,,buffer_strips_PlanningCost,,Communication costs for buffer strips (in dollars),,,,,,,,,,Zoning cost (buffer s.),buffer_zoning_cost,posnorm,3000,,29000,,buffer_strips_PlanningCost,,Cost of zoning (delineation) for buffer strips (in dollars),,,,,,,,,,Plantation cost (buffer s.),buffer_adaptation_cost,posnorm,20000,,130000,,,,Cost of planting new plant and young trees in the buffer strips (in dollars) ,,,,,,,,,,Cost tech devices (buffer s.),buffer_tech_devices_cost,posnorm,1000,,4800,,,,Cost of small technical devices for buffer strips (in dollars),,,,,,,,,,Tree nursery cost (buffer s.),buffer_nursery_cost,posnorm,2000,,18000,,,,Cost of setting up a nursery for the buffer strips (in dollars),,,,,,,,,,Digging wells cost (buffer s.),buffer_wells_cost,posnorm,20000,,80000,,,,Cost of digging wells in the the second buffer for the buffer strips (in dollars),,,,,,,,,,Training cost (buffer s.),buffer_training_cost,posnorm,8000,,46000,,,,Cost of training the communities for buffer strips (in dollars),,,,,,,,,,Equipment cost (buffer s.),buffer_mngmt_oprt_cost,const,0,,0,,,,Equipment and operating costs  for the buffer strips (in dollars),,,,,,,,,,Monitoring cost (buffer s.),buffer_mngmt_follow_cost,const,0,,0,,,,Monitoring cost for the buffer strips (in dollars),,,,,,,,,,Audit cost (buffer s.),buffer_mngmt_audit_cost,const,0,,0,,,,Audit cost for the buffer strips (in dollars),,,,,,,,,,,,,,,,,,,,,,,,,,,,,Annual fish value (base),current_annual_fish_value_USD,posnorm,500,,2000,,,,Annual fish value in the current situation (in dollars),,,,,,,,,,,,,,,,,,,,,,,,,,,,,Irrig. area lost if hazard (formal),Hazard_reduction_irrigated_area,posnorm,10,,30,,,,Irrigated area lost D/S the reservoir if a hazard occurs (in percent) ,,,,,,,550000,,,Irrig. lost if bad maint. (formal),BadMaint_reduction_irrigated_area,posnorm,10,,30,,,,Irrigated area lost D/S the reservoir in case of bad maintenance (in percent) ,,,,,,,418.4141936,,,Irrig. lost if bad design (formal),BadDesign_reduction_irrigated_area,posnorm,10,,30,,,,Irrigated area lost D/S the reservoir in case of bad design (in percent) ,,,,,,,2628.973914,,,,,,,,,,,,,,,,,,,#REF!,,#REF!,rainfed crops buffer 3Fish reduction if hazard,Hazard_reduction_fish_perc,posnorm,5,,15,,,,Decrease in fish production if a hazard occurs (in percent),,,,,,,,,#REF!,fruit trees buffer 3,,,,,,,,,,,,,,,,,,#REF!,fruit trees buffer 3Maint. cost (check d.),maintenance_check_dams,posnorm,160,,400,,,,Annual maintenance cost of check dams (in dollars),,,,,,,,,,Maint. cost (buffer s.),maintenance_buffer_strips,posnorm,800,,7000,,,,Annual maintenance cost of buffer strips (in dollars),,,,,,,,,,,,,,,,,,,,,,,,,,,,,Informal irrig. area (base),scheme2_area_no_dredging_ha,posnorm,0.5,,3,,,,Current irrigation informal area (in ha),,,,,,,,,,Increase in informal irrig. area if dredg. ,dredging_bump_scheme2_area_perc,posnorm,10,,30,,,,Increase in the irrigation informal area in dredging is implemented (in percent),,,,,,,,,,Delay in irrig. area decline (dredg.) (informal),scheme2_time_until_dredging_benefits_gone_baseline,posnorm,2,,4,,,,"If dredging is implemented, delay in time, with respect to the baseline, until irrigated informal area decreases (in years)",,,,,,,,,,Delay in irrig. area decline (check d.) (informal),check_dams_added_scheme2_area_benefit_time,posnorm,2,,4,,,,"If check dams is implemented, delay in time, with respect to the baseline, until irrigated informal area decreases (in years)",,,,,,,,,,,,,,,,,,,,,,,,,,,,,Yield/ton ha-veg. (informal),scheme2_vegetable_yield_t_ha,posnorm,5,,10,,,,Vegetable yields informal area (in t/ha),,,,,,,,,,Profit/ton veg. (informal),scheme2_vegetable_profit_USD_t,posnorm,50,,150,,,,Farmer's profit from vegetable production informal area (in dollars/t),,,,,,,,,,,,,,,,,,,,,,,,,,,,,Yields per ha-rice (informal),scheme2_rice_yield_t_ha,posnorm,1.5,,2,,,,Rice yields informal area  (in t/ha),,,,,,,,,,Profit per ton-rice (informal),scheme2_rice_profit_USD_t,norm,100,,500,,,,Farmer's profit from rice production informal area (in dollars/t),,,,,,,,,,,,,,,,,,,,,,,,,,,,,Veg. area in ha (buffer s.),buffer_vegetable_area_ha,posnorm,5,,7,,,,Area for vegetable production in buffer strips (in ha),,,,,,,,,,Fruit area in ha (buffer s.),buffer_fruit_area_ha,posnorm,1,,2,,,,Area for fruit production in buffer strips (in ha),,,,,,,,,,Rainfed crop area in ha (buffer s.),buffer_rainfed_crop_area_ha,posnorm,6,,8,,,,Area for rainfed crop production in buffer strips (in ha),,,,,,,,,,,,,,,,,,,,,,,,,,,,,Yields per ha-veg. (buffer s.),buffer_vegetable_yield_t_ha,posnorm,5,,10,,,,Vegetable yields in buffer strips (in t/ha),,,,,,,,,,Yields per ha-fruit (buffer s.),buffer_fruit_yield_t_ha,posnorm,10,,30,,,,Fruit yields in buffer strips (in t/ha),,,,,,,,,,Yields per ha-rainfed crops (buffer s.),buffer_rainfed_crop_yield_t_ha,posnorm,1,,3,,,,Rainfed crop yields in buffer strips (in t/ha),,,,,,,,,,,,,,,,,,,,,,,,,,,,,Profit per ton-veg. (buffer s.),buffer_vegetable_profit_USD_t,posnorm,100,,200,,,,Farmer's profit from vegetable production in buffer strips (in dollars/t),,,,,,,,,,Profit per ton-fruit (buffer s.),buffer_fruit_profit_USD_t,posnorm,100,,200,,,,Farmer's profit from fruit production in buffer strips (in dollars/t),,,,,,,,,,Profit per ton-rainfed crops (buffer s.),buffer_rainfed_crop_profit_USD_t,posnorm,50,,200,,,,Farmer's profit from rainfed crops production in buffer strips (in dollars/t),,,,,,,,,,,,,,,,,,,,,,,,,,,,,Rice share rainy season (formal),proportion_irrigation_scheme_rice,tnorm_0_1,0.3,,0.6,,,,Proportion of the formal irrigation area that is allocated to rice production during the rainy season (between 0 and 1),,,,,,,,,,Yields per ha-rice (formal),irrigation_scheme_rice_yield_t_ha,posnorm,1.5,,2.5,,,,Rice formal irrigation area yields  (in t/ha),,,,,,,,,,Profit per ton-rice (formal),irrigation_scheme_rice_profit_USD_t,posnorm,100,,500,,,,Farmer's profit from rice production - formal irrigation area (in dollars/t),,,,,,,,,,Yields per ha-veg. (formal),irrigation_scheme_vegetable_yield_t_ha,posnorm,8,,15,,,,Vegetable formal irrigation area yields  (in t/ha),,,,,,,,,,Profit per ton-veg. (formal),irrigation_scheme_vegetable_profit_USD_t,posnorm,100,,300,,,,Farmer's profit from vegetable production - formal irrigation area (in dollars/t),,,,,,,,,,,,,,,,,,,,,,,,,,,,,Years bef. decline irrig. area (base) (formal),baseline_time_until_irrig_area_declines,posnorm,1,,4,,,,"In the baseline case, time until irrigable formal irrigation area decreases - because of reduced water storage capacity (in years)",,,,,,,,,,Delay in irrig. area decline (dredg.) (formal),dredging_delay_of_irrig_area_decline,posnorm,2,,5,,,,"If dredging is implemented, delay in time, with respect to the baseline, until irrigable formal irrigation area decreases (in years)",,,,,,,,,,Delay in irrig. area decline (check d.) (formal),check_dam_delay_of_irrig_area_decline,posnorm,4,,7,,,,"If check dams is implemented, delay in time, with respect to the baseline, until irrigable formal irrigation area decreases (in years)",,,,,,,,,,Delay in irrig. area decline (buffer s.) (formal),buffer_strip_delay_of_irrig_area_decline,posnorm,4,,15,,,,"If buffer strips is implemented, delay in time, with respect to the baseline, until irrigable formal irrigation area decreases (in years)",,,,,,,,,,Years bef. irrig. area halved (base) (formal),baseline_start_losses_to_half_irrig_area_lost,posnorm,8,,15,,,,"In the baseline case, time before the irrigable formal irrigation area is halved (in years)",,,,,,,,,,Delay in irrig. area halved (dredg.) (formal),dredging_delay_of_irrig_area_halved,posnorm,1,,2,,,,"If dredging is implemented, delay in time, with respect to the baseline, until irrigable formal irrigation area is halved (in years)",,,,,,,,,,Delay in irrig. area halved (check d.) (formal),check_dam_delay_of_irrig_area_halved,posnorm,3,,5,,,,"If check dams is implemented, delay in time, with respect to the baseline, until irrigable formal irrigation area is halved (in years)",,,,,,,,,,Delay in irrig. area halved (buffer s.) (formal),buffer_strip_delay_of_irrig_area_halved,posnorm,8,,20,,,,"If buffer strips is implemented, delay in time, with respect to the baseline, until irrigable formal irrigation area is halved (in years)",,,,,,,,,,,,,,,,,,,,,,,,,,,,,Risk of pipe blockage (at present),current_risk_of_pipe_blockage,tnorm_0_1,0.2,,0.4,,,,Current probability that the pipe is blocked (between 0 and 1),,,,,,,,,,Years bef. blockage every 2nd year (base),baseline_time_until_pipes_blocked_every_second_year,posnorm,3,,5,,,,"In the baseline case, time until the pipes blocked every second year, because pipes are clogged by sediments (in years)",,,,,,,,,,Delay in blockage every 2nd year (dredg.),dredging_delay_of_pipes_blocked_every_second_year,posnorm,1,,3,,,,"If dredging is implemented, delay in time, with respect to the baseline, until pipes are blocked every second year (in years)",,,,,,,,,,Delay in blockage every 2nd year (check d.),check_dam_delay_of_pipes_blocked_every_second_year,posnorm,2,,4,,,,"If check dams is implemented, delay in time, with respect to the baseline, until pipes are blocked every second year (in years)",,,,,,,,,,Delay in blockage every 2nd year (buffer s.),buffer_strip_delay_of_pipes_blocked_every_second_year,posnorm,4,,7,,,,"If buffer strips is implemented, delay in time, with respect to the baseline, until pipes are blocked every second year (in years)",,,,,,,,,,Chance of blocked pipe cleared (at present),current_chance_of_blocked_pipe_cleared,tnorm_0_1,0.7,,0.9,,,,Current probability that a blocked pipe is cleared (between 0 and 1),,,,,,,,,,Years bef. P(blockage cleared)=0.5 (base),baseline_time_until_chance_cleared_50percent,posnorm,7,,10,,,,"In the baseline case, time until the probability that a pipe blocked is cleared is 50 percent (in years)",,,,,,,,,,Delay bef. P(blockage cleared)=0.5 (dredg.),dredging_delay_of_time_until_chance_cleared_50percent,posnorm,1,,2,,,,"If dredging is implemented, delay in time, with respect to the baseline, until the probability that a pipe blocked is cleared is 50 percent (in years)",,,,,,,,,,Delay bef. P(blockage cleared)=0.5 (check d.),check_dam_delay_of_time_until_chance_cleared_50percent,posnorm,2,,4,,,,"If check dams is implemented, delay in time, with respect to the baseline, until the probability that a pipe blocked is cleared is 50 percent (in years)",,,,,,,,,,Delay bef. P(blockage cleared)=0.5 (buffer s.),buffer_strip_delay_of_time_until_chance_cleared_50percent,posnorm,4,,6,,,,"If buffer strips is implemented, delay in time, with respect to the baseline, until the probability that a pipe blocked is cleared is 50 percent (in years)",,,,,,,,,,,,,,,,,,,,,,,,,,,,,Years bef. decline irrig. area (base) (informal),baseline_time_until_irrig_area2_declines,posnorm,3,,6,,,,"In the baseline case, time until irrigable informal area decreases - because of reduced water storage capacity (in years)",,,,,,,,,,Delay in irrig. area decline (dredg.) (informal),dredging_delay_of_irrig_area2_decline,posnorm,3,,5,,,,"If dredging is implemented, delay in time, with respect to the baseline, until irrigable informal area decreases (in years)",,,,,,,,,,Delay in irrig. area decline (check d.) (informal),check_dam_delay_of_irrig_area2_decline,posnorm,2,,6,,,,"If check dams is implemented, delay in time, with respect to the baseline, until irrigable informal area decreases (in years)",,,,,,,,,,Years bef. irrig. area halved (base) (informal),baseline_start_losses_to_half_irrig_area2_lost,posnorm,10,,17,,,,"In the baseline case, time before the irrigable informal area is halved (in years)",,,,,,,,,,Delay in irrig. area halved (dredg.) (informal),dredging_delay_of_irrig_area2_halved,posnorm,1,,2,,,,"If dredging is implemented, delay in time, with respect to the baseline, until irrigable informal area is halved (in years)",,,,,,,,,,Delay in irrig. area halved (check d.) (informal),check_dam_delay_of_irrig_area2_halved,posnorm,3,,5,,,,"If check dams is implemented, delay in time, with respect to the baseline, until irrigable informal area is halved (in years)",,,,,,,,,,,,,,,,,,,,,,,,,,,,,Years bef. decline in fish (base),time_to_start_fish_decline_baseline,posnorm,1,,3,,,,"In the baseline case, time until fish pop. decreases - because of reservoir sedimentation (in years)",,,,,,,,,,Delay in fish decline (dredg.),dredging_delay_start_fish_decline,posnorm,1,,2,,,,"If dredging is implemented, delay in time, with respect to the baseline, until fish pop. decreases (in years)",,,,,,,,,,Delay in fish decline (check d.),check_dams_delay_start_fish_decline,posnorm,2,,4,,,,"If check dams is implemented, delay in time, with respect to the baseline, until fish pop. decreases (in years)",,,,,,,,,,Delay in fish decline (buffer s.),buffer_strips_delay_start_fish_decline,posnorm,3,,6,,,,"If buffer strips is implemented, delay in time, with respect to the baseline, until fish pop. decreases (in years)",,,,,,,,,,Years bef. fish pop. halved D/S (base),time_to_halve_fish_population_baseline,posnorm,14,,20,,,,"In the baseline case, time before the fish population is halved (in years)",,,,,,,,,,Delay in fish pop. halved (dredg.),dredging_delay_in_time_to_halve_fish_population,posnorm,1,,2,,,,"If dredging is implemented, delay in time, with respect to the baseline, until the fish population is halved (in years)",,,,,,,,,,Delay in fish pop. halved (check d.),check_dams_delay_in_time_to_halve_fish_population,posnorm,2,,4,,,,"If check dams is implemented, delay in time, with respect to the baseline, until the fish population is halved (in years)",,,,,,,,,,Delay in fish pop. halved (buffer s.),buffer_strips_delay_in_time_to_halve_fish_population,posnorm,5,,8,,,,"If buffer strips is implemented, delay in time, with respect to the baseline, until the fish population is halved (in years)",,,,,,,,,,,,,,,,,,,,,,,,,,,,,,,,,,,,,,,,,,,,,,,,,,,,,,,,,,,,,,,,,,,NPV for all interventions,NPV_dredge_check_buff,const,1,,1,,,,Net present value if all interventions are implemented (in dollars),,,,,,,,,,NPV if dredging and check dams,NPV_dredge_check_nbuff,const,1,,1,,,,Net present value if dredging and check dams are implemented (in dollars),,,,,,,,,,NPV if dredging and buffer strips,NPV_dredge_ncheck_buff,const,1,,1,,,,Net present value if dredging and buffer strips are implemented (in dollars),,,,,,,,,,NPV if only dredging,NPV_dredge_ncheck_nbuff,const,1,,1,,,,Net present value if only dredging is implemented (in dollars),,,,,,,,,,NPV if check dams and buff strips,NPV_ndredge_check_buff,const,1,,1,,,,Net present value if check dams and buffer strips are implemented (in dollars),,,,,,,,,,NPV if only check dams,NPV_ndredge_check_nbuff,const,1,,1,,,,Net present value if only check dams is implemented (in dollars),,,,,,,,,,NPV if only buffer strips,NPV_ndredge_ncheck_buff,const,1,,1,,,,Net present value if only buffer strips is implemented (in dollars),,,,,,,,,,